<?xml version="1.0" encoding="utf-8" standalone="no"?>

<Course xmlns:xsi="http://www.w3.org/2001/XMLSchema-instance" xsi:noNamespaceSchemaLocation="LMS.xsd">
    <Name>Stream Test</Name>
    <Instance>
        <StartDateTime>2018-05-19T00:00:00</StartDateTime>
        <EndDateTime>2018-05-19T23:59:59</EndDateTime>
    </Instance>
    <Units>
        <Unit>
            <Name>Stream Test 1</Name>
            <Instance>
                <StartDateTime>2018-05-19T11:00:00</StartDateTime>
                <EndDateTime>2018-05-19T13:00:00</EndDateTime>
            </Instance>
            <Resources/>
        </Unit>
    </Units>
    <Trainers/>
    <Students/>
</Course>